video_id,title,published_at,duration_seconds,view_count,like_count,comment_count,tags,description,thumbnail_url
GE-lAftuQgc,The Ocean is Way Deeper Than You Think,2016-11-11T14:13:55Z,396,50319659,629346,44742,real life lore|real life lore maps|real life lore geography|real life maps|world map|world map is wrong|world map with countries|world map real size|map of the world|world geography|geography|geography (field of study)|facts you didn’t know|how deep is the ocean|the ocean is scary|ocean|sea|life|giant squid|mariana trench|challenger deep|earth science|oceanography|earth|how big is the ocean|science|terrifying|scary|weird|strange|ocean depth|the ocean,"Please Subscribe: http://bit.ly/2dB7VTO​​​

Music is by Ross Bugden, seriously, his channel is great.

Song used is called ""Something Wicked"" https://www.youtube.com/watch?v=Zuw_O5MU5CE

Link to Ross's channel: https://www.youtube.com/channel/UCQKGLOK2FqmVgVwYferltKQ 
Please Subscribe: http://bit.ly/2dB7VTO",https://i.ytimg.com/vi/GE-lAftuQgc/maxresdefault.jpg
E39GIysMevQ,What's the Deepest Hole We Can Possibly Dig?,2017-07-07T16:39:53Z,401,48399489,505500,30339,real life lore|real life lore maps|real life lore geography|real life maps|world map|world map is wrong|world map with countries|world map real size|map of the world|world geography|geography|geography (field of study)|facts you didn’t know|deep hole|deepest hole|world's deepest hole|deepest hole in the world|hole|big hole|kola borehole|deepest holes|inside the earth|what's inside the earth|underground|geology|how deep can we dig,"Please Subscribe: http://bit.ly/2dB7VTO

Music is by Brandon Maahs. Check out his website and music by clicking this link: http://www.brandonmaahs.com/audio-reel",https://i.ytimg.com/vi/E39GIysMevQ/maxresdefault.jpg
Iy7NzjCmUf0,How the Universe is Way Bigger Than You Think,2017-04-28T15:43:50Z,546,33092324,595072,82579,real life lore|real life lore maps|real life lore geography|real life maps|world map|world map is wrong|world map with countries|world map real size|map of the world|world geography|geography|geography (field of study)|facts you didn’t know|the universe|how big is the universe|the universe is scary|space|galaxy|milky way|galaxies|existence|existentual crisis|the universe is big|universe is way bigger than you think,"Please Subscribe: http://bit.ly/2dB7VTO

Music is by Brandon Maahs. Check out his website and music by clicking this link: http://www.brandonmaahs.com/audio-reel",https://i.ytimg.com/vi/Iy7NzjCmUf0/maxresdefault.jpg
hOFRbjjjwCE,These Are the Events That Will Happen Before 2050,2017-09-23T14:34:47Z,564,25726185,353791,69953,real life lore|real life lore maps|real life lore geography|real life maps|world map|world map is wrong|world map with countries|world map real size|map of the world|world geography|geography|geography (field of study)|facts you didn’t know|2050|the future|future events|future|what will happen in the future|what 2050 will be like,"Please Subscribe: http://bit.ly/2dB7VTO

Music is by Brandon Maahs. Check out his website and music by clicking this link: http://www.brandonmaahs.com/audio-reel

Video clip courtesy of NASA: https://www.youtube.com/watch?v=Q7iJPQFrrJs",https://i.ytimg.com/vi/hOFRbjjjwCE/maxresdefault.jpg
lPNrtjboISg,How the World Map Looks Wildly Different Than You Think,2016-08-12T09:33:19Z,380,25587760,323716,38310,World map is wrong|You know nothing about the world|maps that prove|Mercator Projection|Wrong|World map|Africa is bigger|What country is bigger|What country is smaller|Russia is big|Russia is small|Greenland|Africa|Australia|UK|Madagascar|Iceland|New Zealand|USA|United States|Texas|Alaska|France|Congo|maps|you know nothing about the world|geography|life hacks|buzzfeed|how to,"All of us have seen a world map at some point in our lives before, but it is very difficult to imagine how certain countries and parts of the world compare to each other in size that are far apart. In this video, I explore why the world looks very different than how it is portrayed in the Mercator Projection map. I then go on to explore how certain countries are unexpectedly larger or smaller than what they appear to be, and how some places looks wildly different than our perceptions.

PS; Don't totally hate on the Mercator Projection, it's actually a really useful map for navigation and on keeping the correct shape of countries while sacrificing the size that we can all laugh about!

Music is by Ross Bugden. He makes excellent music, please check out his channel!

Link to channel: https://www.youtube.com/channel/UCQKGLOK2FqmVgVwYferltKQ?spfreload=5

Link to song used in this video: https://www.youtube.com/watch?v=BbOiqJJ5RxU

Link to download for song: http://www.mediafire.com/download/a4a8eh4hdmrs1d6/Ghibli%27s+Waltz.wav

Link to TheTrueSize.com http://thetruesize.com/#?borders=1~!MTYxMzc1OTI.MzgyMDA2OQ*MzYwMDAwMDA(MA~!CONTIGUOUS_US*MTAwMjQwNzU.MjUwMjM1MTc(MTc1)MA~!IN*NTI2NDA1MQ.Nzg2MzQyMQ)MQ~!CN*OTkyMTY5Nw.NzMxNDcwNQ(MjI1)Mg",https://i.ytimg.com/vi/lPNrtjboISg/maxresdefault.jpg
9mVRc80vhhQ,"5 ""Impossible"" Things That Can Happen On Other Planets",2017-03-03T15:30:18Z,417,25568740,419697,31924,real life lore|real life lore maps|real life lore geography|real life maps|world map|world map is wrong|world map with countries|world map real size|map of the world|world geography|geography|geography (field of study)|facts you didn’t know|space|planets|planet|impossible|impossible things|weird|strange|strange planets|weird planets|exoplanets|exoplanet|astronomy|earth|titan|bizarre planets|hot jupiter|crazy|impossible planets,"Please Subscribe: http://bit.ly/2dB7VTO

Music is by Brandon Maahs. Check out his website and music by clicking this link: http://www.brandonmaahs.com/audio-reel",https://i.ytimg.com/vi/9mVRc80vhhQ/maxresdefault.jpg
If61baWF4GE,Why Russia is Invading Ukraine,2022-02-26T15:30:08Z,1916,21543268,521660,43134,real life lore|real life lore maps|real life lore geography|real life maps|world map|world map is wrong|world map with countries|world map real size|map of the world|world geography|geography|geography (field of study)|facts you didn’t know|russia|ukraine|ukraine invasion,"Watch the full companion video covering Russia's Invasion of Georgia here: https://nebula.tv/videos/reallifelore-modern-conflicts-the-russian-invasion-of-georgia 

Please Subscribe: https://www.youtube.com/channel/UCP5tjEmvPItGyLhmjdwP7Ww

Select video clips courtesy of Getty Images

Select video clips courtesy of the AP Archive

Special thanks to MapTiler / OpenStreetMap Contributors and GEOlayers 3

https://www.maptiler.com/copyright/
https://www.openstreetmap.org/copyright
https://aescripts.com/geolayers/",https://i.ytimg.com/vi/If61baWF4GE/maxresdefault.jpg
OQ9zng2S810,Why North Korea is the Hardest Country to Escape,2021-08-27T15:10:27Z,1278,21221618,458335,25923,real life lore|real life lore maps|real life lore geography|real life maps|world map|world map is wrong|world map with countries|world map real size|map of the world|world geography|geography|geography (field of study)|facts you didn’t know|north korea|north korea border|north korea escape|north korea escape story|north korean defector|escape north korea,"Watch the full companion video to this one covering the Korean Conflict since 2000: https://nebula.tv/videos/real-life-lore-modern-conflicts-north-korea-since-2000 

Please Subscribe: https://www.youtube.com/channel/UCP5tjEmvPItGyLhmjdwP7Ww

Select video clips courtesy of Getty Images

Special thanks to MapTiler / OpenStreetMap Contributors and GEOlayers 3

https://www.maptiler.com/copyright/
https://www.openstreetmap.org/copyright
https://aescripts.com/geolayers/

Please check out Yeonmi Park's YouTube channel. She's an actual defector from North Korea and you can learn significantly more about daily life within the country through her videos here: https://www.youtube.com/channel/UCpQu57KgT7gOoLCAu3FFQsA",https://i.ytimg.com/vi/OQ9zng2S810/maxresdefault.jpg
jlX7tl1QvJs,How North Korea Finally Made It Impossible to Escape,2023-08-04T15:46:38Z,1595,20717501,317503,30474,real life lore|real life lore maps|real life lore geography|real life maps|world map|world map is wrong|world map with countries|world map real size|map of the world|world geography|geography|geography (field of study)|facts you didn’t know,"Get Exclusive NordVPN deal here ➼ https://nordvpn.com/reallifelore It’s risk-free with Nord’s 30-day money-back guarantee!

Please Subscribe: https://www.youtube.com/channel/UCP5tjEmvPItGyLhmjdwP7Ww 

RealLifeLore on Spotify: https://spoti.fi/47yMfzp

RealLifeLore on Facebook: https://www.facebook.com/RealLifeLore/

Select video clips courtesy of Getty Images

Select video clips courtesy of the AP Archive

Special thanks to MapTiler / OpenStreetMap Contributors and GEOlayers 3

https://www.maptiler.com/copyright/
https://www.openstreetmap.org/copyright
https://aescripts.com/geolayers/",https://i.ytimg.com/vi/jlX7tl1QvJs/maxresdefault.jpg
si9Phc9ArpU,Why Finland Joining NATO Checkmates Russia,2022-11-25T15:30:09Z,1572,19327753,218891,37258,real life lore|real life lore maps|real life lore geography|real life maps|world map|world map is wrong|world map with countries|world map real size|map of the world|world geography|geography|geography (field of study)|facts you didn’t know,"Go to https://nordvpn.com/reallifelore  to get a 2-year with a huge discount + 4 extra months free. It’s risk-free with Nord’s 30-day money-back guarantee!
Watch 21 additional RLL videos in my Modern Conflict series on Nebula: https://nebula.tv/modernconflicts 

Please Subscribe: https://www.youtube.com/channel/UCP5tjEmvPItGyLhmjdwP7Ww

RealLifeLore on Spotify: spoti.fi/47yMfzp

RealLifeLore on Facebook: https://www.facebook.com/RealLifeLore/

Select video clips courtesy of Getty Images

Select video clips courtesy of the AP Archive

Special thanks to MapTiler / OpenStreetMap Contributors and GEOlayers 3

https://www.maptiler.com/copyright/
https://www.openstreetmap.org/copyright
https://aescripts.com/geolayers/",https://i.ytimg.com/vi/si9Phc9ArpU/maxresdefault.jpg
3bifbg12u28,How Far Away Can You Get From Everybody Else?,2016-12-09T20:38:44Z,535,18988477,256097,17412,real life lore|real life lore maps|real life lore geography|real life maps|world map|world map is wrong|world map with countries|world map real size|map of the world|world geography|geography|geography (field of study)|facts you didn’t know|how far away can you get|point nemo|bouvet island|antarctica|pacific ocean|islands|isolated|places|nature|island|most|remote|top most remote places to live|most isolated|areas|earth|world|everybody|remote locations,"Music by Ross Bugden: https://www.youtube.com/channel/UCQKGLOK2FqmVgVwYferltKQ

Songs used are Flight Hymn: https://www.youtube.com/watch?v=XCr0bsng60Y

Still: https://www.youtube.com/watch?v=962VmrIh9vQ",https://i.ytimg.com/vi/3bifbg12u28/maxresdefault.jpg
fs1CIrwg5zU,The Terrifying True Scale of Nuclear Weapons,2016-10-07T12:17:29Z,357,16445502,186378,19034,real life lore|real life lore maps|real life lore geography|real life maps|world map|world map is wrong|world map with countries|world map real size|map of the world|world geography|geography|geography (field of study)|facts you didn’t know|nuclear weapons|nuke|nuclear bomb|nuclear explosion|tactical nuke|explosion|bomba nuclear|tsar bomb|tsar bomba|tsar bomb explosion|nuclear weapon test|biggest explosion|nuclear|explosion nuclear|nuclear power,"Nuclear weapons have come a long way and come in all types of different sizes. Some are relatively small while others are enormous, so big they boggle the mind at what they can be capable of. This video analyzes the sizes and impacts of various different nuclear devices, the history of nuclear weapons and what countries in the world are in possession of such devices.

Music used is by Ross Bugden, check out his channel here! https://www.youtube.com/channel/UCQKGLOK2FqmVgVwYferltKQ?spfreload=5

The exact song is titled; Something wicked, and can be found here https://www.youtube.com/watch?v=Zuw_O5MU5CE&spfreload=5

Data gathered from Nukemap, check them out!

Google Earth Pro used for several imaging shots, used under fair use.

Video Credits: Hiroshima bombing and crossroads nuclear weapons test: https://archive.org/details/AFP-67AG_NET356_R-6 used here under fair use.

PLEASE SUBSCRIBE: http://bit.ly/2dB7VTO

Follow us on Facebook: https://www.facebook.com/RealLifeLore/
Follow us on Twitter: https://twitter.com/RealLifeLore1

Videos explaining things. Mostly over topics like history, geography, economics and science. 

We believe that the world is a wonderfully fascinating place, and you can find wonder anywhere you look. That is what our videos attempt to convey. 

Currently, we try our best to release one video every two weeks. Bear with us :)

Business Email: thereallifelore@gmail.com",https://i.ytimg.com/vi/fs1CIrwg5zU/maxresdefault.jpg
ap4eVlcYLww,What's the Most Difficult Place to Get to In the World?,2017-03-10T15:41:57Z,534,14632422,205697,13718,real life lore|real life lore maps|real life lore geography|real life maps|world map|world map is wrong|world map with countries|world map real size|map of the world|world geography|geography|geography (field of study)|facts you didn’t know|travel|difficult to get to|most difficult place|hardest place|k2|mount everest|pitcairn island|kerguelen islands|annapurna|difficult travel|travel time|travel guide|travel video|travel the world,"Please Subscribe: http://bit.ly/2dB7VTO

Music is by Brandon Maahs. Check out his website and music by clicking this link: http://www.brandonmaahs.com/audio-reel",https://i.ytimg.com/vi/ap4eVlcYLww/maxresdefault.jpg
TnB_8Zm9lPk,Why 95% of Australia is Empty,2022-06-04T14:30:11Z,1847,14364523,160710,16340,real life lore|real life lore maps|real life lore geography|real life maps|world map|world map is wrong|world map with countries|world map real size|map of the world|world geography|geography|geography (field of study)|facts you didn’t know,"Watch more than 20 additional RealLifeLore videos in my Modern Conflicts series on Nebula: https://nebula.tv/modernconflicts

Please Subscribe: https://www.youtube.com/channel/UCP5tjEmvPItGyLhmjdwP7Ww

Select video clips courtesy of Getty Images

Select video clips courtesy of the AP Archive

Special thanks to MapTiler / OpenStreetMap Contributors and GEOlayers 3

https://www.maptiler.com/copyright/
https://www.openstreetmap.org/copyright
https://aescripts.com/geolayers/",https://i.ytimg.com/vi/TnB_8Zm9lPk/maxresdefault.jpg
L6tJ-mvhznU,The World's Strangest Borders Part 2: Spain,2017-01-06T15:21:44Z,332,14096570,142511,13130,real life lore|real life lore maps|real life lore geography|real life maps|world map|world map is wrong|world map with countries|world map real size|map of the world|world geography|geography|geography (field of study)|facts you didn’t know|spain|bizarre borders|strange borders|borders|strangest borders|ceuta|melilla|complex borders|terrible borders|weird borders|weird country borders|most complex borders|beyond borders|crazy borders|international,"There are some really weird borders in the world, and Spain is probably the cause of some of the strangest.

Please Subscribe: http://bit.ly/2dB7VTO

Music is by Ross Bugden, seriously check out his channel here! https://www.youtube.com/channel/UCQKGLOK2FqmVgVwYferltKQ 
Song used is titled ""The Wild West"" https://www.youtube.com/watch?v=VDPMAuv-3nk 

Follow us on Facebook: https://www.facebook.com/RealLifeLore/
Follow us on Twitter: https://twitter.com/RealLifeLore1
Subreddit: https://www.reddit.com/r/RealLifeLore/

Subreddit is moderated by Oliver Bourdouxhe

Special Thanks to Patrons: Joshua Tavares, Wesley Jackson and Matthew Mikulka.

Videos explaining things. Mostly over topics like history, geography, economics and science. 

We believe that the world is a wonderfully fascinating place, and you can find wonder anywhere you look. That is what our videos attempt to convey. 

Currently, we try our best to release one video every two weeks. Bear with us :)

Business Email: thereallifelore@gmail.com",https://i.ytimg.com/vi/L6tJ-mvhznU/maxresdefault.jpg
7oaGUg7ik_c,How Big do Tsunamis Get?,2016-12-30T15:35:58Z,457,14026026,138413,13535,real life lore|real life lore maps|real life lore geography|real life maps|world map|world map is wrong|world map with countries|world map real size|map of the world|world geography|geography|geography (field of study)|facts you didn’t know|tsunami|tsunami (disaster type)|tsunami 2004|tsunami 2011|lituya bay|vajont dam|japan tsunami|giant tsunami|huge tsunami|massive tsunami|tidal wave|waves|how big do|how big|hawaii|tsunamis|big wave|huge wave,"Please Subscribe: http://bit.ly/2dB7VTO

Music is by Ross Bugden, check out his channel for some truly awesome music! https://www.youtube.com/channel/UCQKGLOK2FqmVgVwYferltKQ

Song used is titled ""Drive"" https://www.youtube.com/watch?v=3pZdZiPnsGs",https://i.ytimg.com/vi/7oaGUg7ik_c/maxresdefault.jpg
RqrrWejHHeI,What Happens If Yellowstone Blows Up Tomorrow?,2021-05-26T16:55:19Z,882,13607396,225687,26675,real life lore|real life lore maps|real life lore geography|real life maps|world map|world map is wrong|world map with countries|world map real size|map of the world|world geography|geography|geography (field of study)|facts you didn’t know|yellowstone|volcano|Yellowstone eruption|Yellowstone explosion|Yellowstone volcano|what if yellowstone|what if Yellowstone erupts|supervolcano,"Watch this video ad-free on Nebula: https://nebula.tv/videos/real-life-lore-what-happens-if-yellowstone-blows-up-tomorrow

Please Subscribe: https://www.youtube.com/channel/UCP5tjEmvPItGyLhmjdwP7Ww

Select video clips courtesy of Getty Images",https://i.ytimg.com/vi/RqrrWejHHeI/maxresdefault.jpg
ZbhqHCqjoZ0,This Is What Will Happen in the Next Billion Years,2017-05-12T16:18:25Z,464,13221861,189467,26785,real life lore|real life lore maps|real life lore geography|real life maps|world map|world map is wrong|world map with countries|world map real size|map of the world|world geography|geography|geography (field of study)|facts you didn’t know|this is what will happen|billion years|billion|the future|future predictions|what will happen in the future|future|futurology|futuristic|pangea|future earth|earth in the future|humanity|future of humanity,"Please Subscribe: http://bit.ly/2dB7VTO

Music is by Brandon Maahs. Check out his website and music by clicking this link: http://www.brandonmaahs.com/audio-reel

Pangea Ultima map used under a creative commons attribution, with link to original owner here. Check out his artwork please, it's incredible stuff! http://vladar4.deviantart.com/art/Pangaea-Ultima-no-labels-version-WIP-613662938",https://i.ytimg.com/vi/ZbhqHCqjoZ0/maxresdefault.jpg
UbffuGZHeR0,What If Only 100 People Existed on Earth?,2017-06-09T15:17:11Z,436,12371377,239114,22497,real life lore|real life lore maps|real life lore geography|real life maps|world map|world map is wrong|world map with countries|world map real size|map of the world|world geography|geography|geography (field of study)|facts you didn’t know|100 people|people|society|earth|culture|demographics|world demographics|world|what if|what if 100 people,"Please Subscribe: http://bit.ly/2dB7VTO

Music is by Brandon Maahs. Check out his website and music by clicking this link: http://www.brandonmaahs.com/audio-reel",https://i.ytimg.com/vi/UbffuGZHeR0/maxresdefault.jpg
HfLVYr38D0Q,Where Was the Last Place Discovered on Earth?,2016-10-21T15:47:15Z,531,11998881,183483,22148,real life lore|real life lore maps|real life lore geography|real life maps|world map|world map is wrong|world map with countries|world map real size|map of the world|world geography|geography|geography (field of study)|facts you didn’t know|discovery|human exploration|is there anywhere|civ 6|the world|in the world|the earth|travel|facts|true facts about|interesting facts|antartica|antarctica|adventure of lifetime|the adventure|who discovered america,"Humanity has been around for a very long time and it seems like we've discovered just about everything in the world today. But that didn't always used to be the case, the world used to be a huge place waiting to be explored. The question I try to answer in this video is where were the last places, as well as the first places that the human species actually discovered on our world? Spanning hundreds of thousands of years in under 9 minutes, we attempt to give our greatest and quickest answer to that question.

Music is by the wonderful Ross Bugden, please go and check out his channel if you haven't already done so. His music is great stuff!

Song used in video; Olympus: https://www.youtube.com/watch?v=BnmglWHoVrk

Link to Ross Bugden's channel: https://www.youtube.com/channel/UCQKGLOK2FqmVgVwYferltKQ?spfreload=5

Civilization Icons and logos are the property of Firaxis Games and 2K Games. They are used here briefly under fair use, and in fact you should probably get Civilization 6. It's awesome.

Please Subscribe: http://bit.ly/2dB7VTO

Follow us on Facebook: https://www.facebook.com/RealLifeLore/
Follow us on Twitter: https://twitter.com/RealLifeLore1

Videos explaining things. Mostly over topics like history, geography, economics and science. 

We believe that the world is a wonderfully fascinating place, and you can find wonder anywhere you look. That is what our videos attempt to convey. 

Currently, we try our best to release one video every two weeks. Bear with us :)

Business Email: thereallifelore@gmail.com",https://i.ytimg.com/vi/HfLVYr38D0Q/maxresdefault.jpg
pIxRVfCpA64,How Will Earth Change If All the Ice Melts?,2017-07-28T15:00:27Z,394,11933205,145780,38343,real life lore|real life lore maps|real life lore geography|real life maps|world map|world map is wrong|world map with countries|world map real size|map of the world|world geography|geography|geography (field of study)|facts you didn’t know|ice melt|ice melts|what if all the ice melts|global warming|climate change|future earth|future geography|flooding|flood|inconvenient sequel|climate|natural disasters|natural disaster|ice|all the ice melts,"Please Subscribe: http://bit.ly/2dB7VTO

Music is by Brandon Maahs. Check out his website and music by clicking this link: http://www.brandonmaahs.com/audio-reel

Sources and additional reading...

http://journals.ametsoc.org/doi/abs/10.1175/WCAS-D-13-00059.1 

https://climateandsecurity.org/2012/02/29/syria-climate-change-drought-and-social-unrest/ 

https://tidesandcurrents.noaa.gov/publications/techrpt83_Global_and_Regional_SLR_Scenarios_for_the_US_final.pdf 

http://www.pnas.org/content/110/34/13745.abstract?sid=26fd1d37-7276-46e2-9192-0931e6ebf6ab 

http://www.ipcc.ch/publications_and_data/ar4/wg2/en/spm.html 

http://www.nature.com/nature/journal/v531/n7596/full/nature17145.html 

http://web.worldbank.org/WBSITE/EXTERNAL/COUNTRIES/SOUTHASIAEXT/0,,contentMDK:22413695~pagePK:146736~piPK:146830~theSitePK:223547,00.html

https://climate.nasa.gov/evidence/ 

https://en.wikipedia.org/wiki/Effects_of_climate_change_on_island_nations

http://geology.com/sea-level-rise/

http://ss2.climatecentral.org/#8/38.219/-120.542?show=satellite&projections=0-RCP85-SLR&level=30&unit=meters&pois=hide

https://www.washingtonpost.com/news/capital-weather-gang/wp/2016/03/30/what-6-feet-of-sea-level-rise-looks-like-for-our-vulnerable-coastal-cities/?utm_term=.c3f8f3fecef6

https://en.wikipedia.org/wiki/Sea_level_rise

https://en.wikipedia.org/wiki/Effects_of_global_warming_on_humans

http://news.cornell.edu/stories/2017/06/rising-seas-could-result-2-billion-refugees-2100

https://sealevel.nasa.gov/understanding-sea-level/projections/empirical-projections

https://climate.nasa.gov/scientific-consensus/

https://climate.nasa.gov/

https://visibleearth.nasa.gov/view.php?id=3741",https://i.ytimg.com/vi/pIxRVfCpA64/maxresdefault.jpg
pL8XPZp4-5c,Why 70% of Spain is Empty,2022-05-06T14:30:09Z,932,11894465,167286,13960,real life lore|real life lore maps|real life lore geography|real life maps|world map|world map is wrong|world map with countries|world map real size|map of the world|world geography|geography|geography (field of study)|facts you didn’t know|spain|empty spain,"Watch more than 20 additional RealLifeLore videos in my Modern Conflicts series on Nebula: https://nebula.tv/modernconflicts

Please Subscribe: https://www.youtube.com/channel/UCP5tjEmvPItGyLhmjdwP7Ww

Select video clips courtesy of Getty Images

Select video clips courtesy of the AP Archive

Special thanks to MapTiler / OpenStreetMap Contributors and GEOlayers 3

https://www.maptiler.com/copyright/
https://www.openstreetmap.org/copyright
https://aescripts.com/geolayers/

Paid endorsement for Open To The Public Investing, member FINRA & SIPC. Not investment advice. All investing involves risk. New customers receive free stock with value $3-1,000; .3% receive the max value.",https://i.ytimg.com/vi/pL8XPZp4-5c/maxresdefault.jpg
